### DISCUSSION TITLE
Connection reset after exception raised & handled in FastAPI

### DISCUSSION THREAD

**Discussion by mcgrawia** [Kludex/uvicorn#2285] [Potential Issue] [answered]
Hi Uvicorn team,

When using an exception handler in a FastAPI application, I am seeing subsequent requests terminated with the following issue:
```
requests.exceptions.ConnectionError: ('Connection aborted.', ConnectionResetError(54, 'Connection reset by peer'))
```

I've included a sample application, script, and tcpdump that can be used to reproduce the behavior. I'd appreciate some help understanding if this is something misconfigured on my side, or if this is a bug. Thanks.

## How to reproduce

**Sample App**
```python
from fastapi import FastAPI, Request
from fastapi.responses import JSONResponse
from starlette.status import HTTP_500_INTERNAL_SERVER_ERROR, HTTP_400_BAD_REQUEST
from pydantic import BaseModel, Field
from uvicorn import run


class Message(BaseModel):
    message: str


app = FastAPI(title="Test app")


@app.post("/error")
def error(body: Message) -> JSONResponse:
    raise Exception(body.message)


@app.post("/ok")
def ok(body: Message) -> JSONResponse:
    return JSONResponse(status_code=200, content="ok")


@app.exception_handler(Exception)
async def catch_all_exception_handler(request: Request, exc: Exception) -> JSONResponse:
    return JSONResponse(
        status_code=HTTP_400_BAD_REQUEST, content={"detail": str(exc)}
    )


if __name__ == "__main__":
    run(app, host="127.0.0.1", port=8000)
```

**Sample client script**
```python
from requests.sessions import Session


def main():
    session = Session()
    resp = session.post("http://127.0.0.1:8000/error", json={"message": "test error"})
    assert resp.status_code == 400
    resp = session.post("http://127.0.0.1:8000/ok", json={"message": "test error"})


if __name__ == "__main__":
    main()
```

**Logs from the client script**
```
Traceback (most recent call last):
  File "/Users/ianmcgraw/miniconda3/envs/scope/lib/python3.12/site-packages/urllib3/connectionpool.py", line 791, in urlopen
    response = self._make_request(
               ^^^^^^^^^^^^^^^^^^^
  File "/Users/ianmcgraw/miniconda3/envs/scope/lib/python3.12/site-packages/urllib3/connectionpool.py", line 537, in _make_request
    response = conn.getresponse()
               ^^^^^^^^^^^^^^^^^^
  File "/Users/ianmcgraw/miniconda3/envs/scope/lib/python3.12/site-packages/urllib3/connection.py", line 461, in getresponse
    httplib_response = super().getresponse()
                       ^^^^^^^^^^^^^^^^^^^^^
  File "/Users/ianmcgraw/miniconda3/envs/scope/lib/python3.12/http/client.py", line 1419, in getresponse
    response.begin()
  File "/Users/ianmcgraw/miniconda3/envs/scope/lib/python3.12/http/client.py", line 331, in begin
    version, status, reason = self._read_status()
                              ^^^^^^^^^^^^^^^^^^^
  File "/Users/ianmcgraw/miniconda3/envs/scope/lib/python3.12/http/client.py", line 292, in _read_status
    line = str(self.fp.readline(_MAXLINE + 1), "iso-8859-1")
               ^^^^^^^^^^^^^^^^^^^^^^^^^^^^^^
  File "/Users/ianmcgraw/miniconda3/envs/scope/lib/python3.12/socket.py", line 707, in readinto
    return self._sock.recv_into(b)
           ^^^^^^^^^^^^^^^^^^^^^^^
ConnectionResetError: [Errno 54] Connection reset by peer

During handling of the above exception, another exception occurred:

Traceback (most recent call last):
  File "/Users/ianmcgraw/miniconda3/envs/scope/lib/python3.12/site-packages/requests/adapters.py", line 486, in send
    resp = conn.urlopen(
           ^^^^^^^^^^^^^
  File "/Users/ianmcgraw/miniconda3/envs/scope/lib/python3.12/site-packages/urllib3/connectionpool.py", line 845, in urlopen
    retries = retries.increment(
              ^^^^^^^^^^^^^^^^^^
  File "/Users/ianmcgraw/miniconda3/envs/scope/lib/python3.12/site-packages/urllib3/util/retry.py", line 470, in increment
    raise reraise(type(error), error, _stacktrace)
          ^^^^^^^^^^^^^^^^^^^^^^^^^^^^^^^^^^^^^^^^
  File "/Users/ianmcgraw/miniconda3/envs/scope/lib/python3.12/site-packages/urllib3/util/util.py", line 38, in reraise
    raise value.with_traceback(tb)
  File "/Users/ianmcgraw/miniconda3/envs/scope/lib/python3.12/site-packages/urllib3/connectionpool.py", line 791, in urlopen
    response = self._make_request(
               ^^^^^^^^^^^^^^^^^^^
  File "/Users/ianmcgraw/miniconda3/envs/scope/lib/python3.12/site-packages/urllib3/connectionpool.py", line 537, in _make_request
    response = conn.getresponse()
               ^^^^^^^^^^^^^^^^^^
  File "/Users/ianmcgraw/miniconda3/envs/scope/lib/python3.12/site-packages/urllib3/connection.py", line 461, in getresponse
    httplib_response = super().getresponse()
                       ^^^^^^^^^^^^^^^^^^^^^
  File "/Users/ianmcgraw/miniconda3/envs/scope/lib/python3.12/http/client.py", line 1419, in getresponse
    response.begin()
  File "/Users/ianmcgraw/miniconda3/envs/scope/lib/python3.12/http/client.py", line 331, in begin
    version, status, reason = self._read_status()
                              ^^^^^^^^^^^^^^^^^^^
  File "/Users/ianmcgraw/miniconda3/envs/scope/lib/python3.12/http/client.py", line 292, in _read_status
    line = str(self.fp.readline(_MAXLINE + 1), "iso-8859-1")
               ^^^^^^^^^^^^^^^^^^^^^^^^^^^^^^
  File "/Users/ianmcgraw/miniconda3/envs/scope/lib/python3.12/socket.py", line 707, in readinto
    return self._sock.recv_into(b)
           ^^^^^^^^^^^^^^^^^^^^^^^
urllib3.exceptions.ProtocolError: ('Connection aborted.', ConnectionResetError(54, 'Connection reset by peer'))

During handling of the above exception, another exception occurred:

Traceback (most recent call last):
  File "/Users/ianmcgraw/dev/arthur-scope/test-client/python_requests.py", line 12, in <module>
    main()
  File "/Users/ianmcgraw/dev/arthur-scope/test-client/python_requests.py", line 8, in main
    resp = session.post("http://127.0.0.1:8000/ok", json={"message": "test error"})
           ^^^^^^^^^^^^^^^^^^^^^^^^^^^^^^^^^^^^^^^^^^^^^^^^^^^^^^^^^^^^^^^^^^^^^^^^
  File "/Users/ianmcgraw/miniconda3/envs/scope/lib/python3.12/site-packages/requests/sessions.py", line 637, in post
    return self.request("POST", url, data=data, json=json, **kwargs)
           ^^^^^^^^^^^^^^^^^^^^^^^^^^^^^^^^^^^^^^^^^^^^^^^^^^^^^^^^^
  File "/Users/ianmcgraw/miniconda3/envs/scope/lib/python3.12/site-packages/requests/sessions.py", line 589, in request
    resp = self.send(prep, **send_kwargs)
           ^^^^^^^^^^^^^^^^^^^^^^^^^^^^^^
  File "/Users/ianmcgraw/miniconda3/envs/scope/lib/python3.12/site-packages/requests/sessions.py", line 703, in send
    r = adapter.send(request, **kwargs)
        ^^^^^^^^^^^^^^^^^^^^^^^^^^^^^^^
  File "/Users/ianmcgraw/miniconda3/envs/scope/lib/python3.12/site-packages/requests/adapters.py", line 501, in send
    raise ConnectionError(err, request=request)
requests.exceptions.ConnectionError: ('Connection aborted.', ConnectionResetError(54, 'Connection reset by peer'))

Process finished with exit code 1
```

**tcpdump of the server port while the client script is running**
This shows the final tcp reset packet sent to the client
```
$ tcpdump -i lo0 port 8000 -n
09:09:35.160790 IP 127.0.0.1.59766 > 127.0.0.1.8000: Flags [S], seq 2953276412, win 65535, options [mss 16344,nop,wscale 6,nop,nop,TS val 1993762755 ecr 0,sackOK,eol], length 0
09:09:35.160885 IP 127.0.0.1.8000 > 127.0.0.1.59766: Flags [S.], seq 937080665, ack 2953276413, win 65535, options [mss 16344,nop,wscale 6,nop,nop,TS val 2900939613 ecr 1993762755,sackOK,eol], length 0
09:09:35.160893 IP 127.0.0.1.59766 > 127.0.0.1.8000: Flags [.], ack 1, win 6379, options [nop,nop,TS val 1993762755 ecr 2900939613], length 0
09:09:35.160899 IP 127.0.0.1.8000 > 127.0.0.1.59766: Flags [.], ack 1, win 6379, options [nop,nop,TS val 2900939613 ecr 1993762755], length 0
09:09:35.160960 IP 127.0.0.1.59766 > 127.0.0.1.8000: Flags [P.], seq 1:204, ack 1, win 6379, options [nop,nop,TS val 1993762755 ecr 2900939613], length 203
09:09:35.160983 IP 127.0.0.1.8000 > 127.0.0.1.59766: Flags [.], ack 204, win 6376, options [nop,nop,TS val 2900939613 ecr 1993762755], length 0
09:09:35.160988 IP 127.0.0.1.59766 > 127.0.0.1.8000: Flags [P.], seq 204:229, ack 1, win 6379, options [nop,nop,TS val 1993762755 ecr 2900939613], length 25
09:09:35.161001 IP 127.0.0.1.8000 > 127.0.0.1.59766: Flags [.], ack 229, win 6376, options [nop,nop,TS val 2900939613 ecr 1993762755], length 0
09:09:35.167097 IP 127.0.0.1.8000 > 127.0.0.1.59766: Flags [P.], seq 1:135, ack 229, win 6376, options [nop,nop,TS val 2900939619 ecr 1993762755], length 134
09:09:35.167109 IP 127.0.0.1.59766 > 127.0.0.1.8000: Flags [.], ack 135, win 6377, options [nop,nop,TS val 1993762761 ecr 2900939619], length 0
09:09:35.167128 IP 127.0.0.1.8000 > 127.0.0.1.59766: Flags [P.], seq 135:158, ack 229, win 6376, options [nop,nop,TS val 2900939619 ecr 1993762761], length 23
09:09:35.167133 IP 127.0.0.1.59766 > 127.0.0.1.8000: Flags [.], ack 158, win 6377, options [nop,nop,TS val 1993762761 ecr 2900939619], length 0
09:09:35.168871 IP 127.0.0.1.59766 > 127.0.0.1.8000: Flags [P.], seq 229:429, ack 158, win 6377, options [nop,nop,TS val 1993762763 ecr 2900939619], length 200
09:09:35.168897 IP 127.0.0.1.8000 > 127.0.0.1.59766: Flags [.], ack 429, win 6373, options [nop,nop,TS val 2900939621 ecr 1993762763], length 0
09:09:35.168898 IP 127.0.0.1.59766 > 127.0.0.1.8000: Flags [P.], seq 429:454, ack 158, win 6377, options [nop,nop,TS val 1993762763 ecr 2900939619], length 25
09:09:35.168905 IP 127.0.0.1.8000 > 127.0.0.1.59766: Flags [.], ack 454, win 6372, options [nop,nop,TS val 2900939621 ecr 1993762763], length 0
09:09:35.177816 IP 127.0.0.1.8000 > 127.0.0.1.59766: Flags [R.], seq 158, ack 454, win 6372, length 0
```

## Interesting Observations

1. Adding `time.sleep(0.1)` in between the requests in the client scripts resolves the issue. Could this be some sort of race condition?
2. Removing the exception from the `/error` endpoint also resolves the issue. This seems like something specific to the exception handler

**Comment by Kludex** [comment]
What are the logs from the server side?

**Reply by mcgrawia** [reply]
Hi @Kludex, thanks for the help. Here are the logs:
```
INFO:     Started server process [47434]
INFO:     Waiting for application startup.
INFO:     Application startup complete.
INFO:     Uvicorn running on http://127.0.0.1:8000 (Press CTRL+C to quit)
INFO:     127.0.0.1:60298 - "POST /error HTTP/1.1" 400 Bad Request
ERROR:    Exception in ASGI application
Traceback (most recent call last):
  File "/Users/ianmcgraw/miniconda3/envs/scope/lib/python3.12/site-packages/uvicorn/protocols/http/h11_impl.py", line 407, in run_asgi
    result = await app(  # type: ignore[func-returns-value]
             ^^^^^^^^^^^^^^^^^^^^^^^^^^^^^^^^^^^^^^^^^^^^^^
  File "/Users/ianmcgraw/miniconda3/envs/scope/lib/python3.12/site-packages/uvicorn/middleware/proxy_headers.py", line 69, in __call__
    return await self.app(scope, receive, send)
           ^^^^^^^^^^^^^^^^^^^^^^^^^^^^^^^^^^^^
  File "/Users/ianmcgraw/miniconda3/envs/scope/lib/python3.12/site-packages/fastapi/applications.py", line 1054, in __call__
    await super().__call__(scope, receive, send)
  File "/Users/ianmcgraw/miniconda3/envs/scope/lib/python3.12/site-packages/starlette/applications.py", line 123, in __call__
    await self.middleware_stack(scope, receive, send)
  File "/Users/ianmcgraw/miniconda3/envs/scope/lib/python3.12/site-packages/starlette/middleware/errors.py", line 186, in __call__
    raise exc
  File "/Users/ianmcgraw/miniconda3/envs/scope/lib/python3.12/site-packages/starlette/middleware/errors.py", line 164, in __call__
    await self.app(scope, receive, _send)
  File "/Users/ianmcgraw/miniconda3/envs/scope/lib/python3.12/site-packages/starlette/middleware/exceptions.py", line 62, in __call__
    await wrap_app_handling_exceptions(self.app, conn)(scope, receive, send)
  File "/Users/ianmcgraw/miniconda3/envs/scope/lib/python3.12/site-packages/starlette/_exception_handler.py", line 64, in wrapped_app
    raise exc
  File "/Users/ianmcgraw/miniconda3/envs/scope/lib/python3.12/site-packages/starlette/_exception_handler.py", line 53, in wrapped_app
    await app(scope, receive, sender)
  File "/Users/ianmcgraw/miniconda3/envs/scope/lib/python3.12/site-packages/starlette/routing.py", line 758, in __call__
    await self.middleware_stack(scope, receive, send)
  File "/Users/ianmcgraw/miniconda3/envs/scope/lib/python3.12/site-packages/starlette/routing.py", line 778, in app
    await route.handle(scope, receive, send)
  File "/Users/ianmcgraw/miniconda3/envs/scope/lib/python3.12/site-packages/starlette/routing.py", line 299, in handle
    await self.app(scope, receive, send)
  File "/Users/ianmcgraw/miniconda3/envs/scope/lib/python3.12/site-packages/starlette/routing.py", line 79, in app
    await wrap_app_handling_exceptions(app, request)(scope, receive, send)
  File "/Users/ianmcgraw/miniconda3/envs/scope/lib/python3.12/site-packages/starlette/_exception_handler.py", line 64, in wrapped_app
    raise exc
  File "/Users/ianmcgraw/miniconda3/envs/scope/lib/python3.12/site-packages/starlette/_exception_handler.py", line 53, in wrapped_app
    await app(scope, receive, sender)
  File "/Users/ianmcgraw/miniconda3/envs/scope/lib/python3.12/site-packages/starlette/routing.py", line 74, in app
    response = await func(request)
               ^^^^^^^^^^^^^^^^^^^
  File "/Users/ianmcgraw/miniconda3/envs/scope/lib/python3.12/site-packages/fastapi/routing.py", line 299, in app
    raise e
  File "/Users/ianmcgraw/miniconda3/envs/scope/lib/python3.12/site-packages/fastapi/routing.py", line 294, in app
    raw_response = await run_endpoint_function(
                   ^^^^^^^^^^^^^^^^^^^^^^^^^^^^
  File "/Users/ianmcgraw/miniconda3/envs/scope/lib/python3.12/site-packages/fastapi/routing.py", line 193, in run_endpoint_function
    return await run_in_threadpool(dependant.call, **values)
           ^^^^^^^^^^^^^^^^^^^^^^^^^^^^^^^^^^^^^^^^^^^^^^^^^
  File "/Users/ianmcgraw/miniconda3/envs/scope/lib/python3.12/site-packages/starlette/concurrency.py", line 42, in run_in_threadpool
    return await anyio.to_thread.run_sync(func, *args)
           ^^^^^^^^^^^^^^^^^^^^^^^^^^^^^^^^^^^^^^^^^^^
  File "/Users/ianmcgraw/miniconda3/envs/scope/lib/python3.12/site-packages/anyio/to_thread.py", line 56, in run_sync
    return await get_async_backend().run_sync_in_worker_thread(
           ^^^^^^^^^^^^^^^^^^^^^^^^^^^^^^^^^^^^^^^^^^^^^^^^^^^^
  File "/Users/ianmcgraw/miniconda3/envs/scope/lib/python3.12/site-packages/anyio/_backends/_asyncio.py", line 2134, in run_sync_in_worker_thread
    return await future
           ^^^^^^^^^^^^
  File "/Users/ianmcgraw/miniconda3/envs/scope/lib/python3.12/site-packages/anyio/_backends/_asyncio.py", line 851, in run
    result = context.run(func, *args)
             ^^^^^^^^^^^^^^^^^^^^^^^^
  File "/Users/ianmcgraw/dev/arthur-scope/test-client/app.py", line 17, in error
    raise Exception(body.message)
Exception: test error
```

**Reply by Kludex** [reply]
Can you enable `--log-level trace`, and give me the full logs?

**Reply by mcgrawia** [reply]
Sure thing, here you go:
```
uvicorn app:app --log-level trace
INFO:     Started server process [49985]
INFO:     Waiting for application startup.
TRACE:    ASGI [1] Started scope={'type': 'lifespan', 'asgi': {'version': '3.0', 'spec_version': '2.0'}, 'state': {}}
TRACE:    ASGI [1] Receive {'type': 'lifespan.startup'}
TRACE:    ASGI [1] Send {'type': 'lifespan.startup.complete'}
INFO:     Application startup complete.
INFO:     Uvicorn running on http://127.0.0.1:8000 (Press CTRL+C to quit)
TRACE:    127.0.0.1:60338 - HTTP connection made
TRACE:    127.0.0.1:60338 - ASGI [2] Started scope={'type': 'http', 'asgi': {'version': '3.0', 'spec_version': '2.4'}, 'http_version': '1.1', 'server': ('127.0.0.1', 8000), 'client': ('127.0.0.1', 60338), 'scheme': 'http', 'method': 'POST', 'root_path': '', 'path': '/error', 'raw_path': b'/error', 'query_string': b'', 'headers': '<...>', 'state': {}}
TRACE:    127.0.0.1:60338 - ASGI [2] Receive {'type': 'http.request', 'body': '<25 bytes>', 'more_body': False}
TRACE:    127.0.0.1:60338 - ASGI [2] Send {'type': 'http.response.start', 'status': 400, 'headers': '<...>'}
INFO:     127.0.0.1:60338 - "POST /error HTTP/1.1" 400 Bad Request
TRACE:    127.0.0.1:60338 - ASGI [2] Send {'type': 'http.response.body', 'body': '<23 bytes>'}
TRACE:    127.0.0.1:60338 - ASGI [2] Raised exception
ERROR:    Exception in ASGI application
Traceback (most recent call last):
  File "/Users/ianmcgraw/miniconda3/envs/openapitest/lib/python3.12/site-packages/uvicorn/protocols/http/h11_impl.py", line 407, in run_asgi
    result = await app(  # type: ignore[func-returns-value]
             ^^^^^^^^^^^^^^^^^^^^^^^^^^^^^^^^^^^^^^^^^^^^^^
  File "/Users/ianmcgraw/miniconda3/envs/openapitest/lib/python3.12/site-packages/uvicorn/middleware/proxy_headers.py", line 69, in __call__
    return await self.app(scope, receive, send)
           ^^^^^^^^^^^^^^^^^^^^^^^^^^^^^^^^^^^^
  File "/Users/ianmcgraw/miniconda3/envs/openapitest/lib/python3.12/site-packages/uvicorn/middleware/message_logger.py", line 84, in __call__
    raise exc from None
  File "/Users/ianmcgraw/miniconda3/envs/openapitest/lib/python3.12/site-packages/uvicorn/middleware/message_logger.py", line 80, in __call__
    await self.app(scope, inner_receive, inner_send)
  File "/Users/ianmcgraw/miniconda3/envs/openapitest/lib/python3.12/site-packages/fastapi/applications.py", line 1054, in __call__
    await super().__call__(scope, receive, send)
  File "/Users/ianmcgraw/miniconda3/envs/openapitest/lib/python3.12/site-packages/starlette/applications.py", line 123, in __call__
    await self.middleware_stack(scope, receive, send)
  File "/Users/ianmcgraw/miniconda3/envs/openapitest/lib/python3.12/site-packages/starlette/middleware/errors.py", line 186, in __call__
    raise exc
  File "/Users/ianmcgraw/miniconda3/envs/openapitest/lib/python3.12/site-packages/starlette/middleware/errors.py", line 164, in __call__
    await self.app(scope, receive, _send)
  File "/Users/ianmcgraw/miniconda3/envs/openapitest/lib/python3.12/site-packages/starlette/middleware/exceptions.py", line 62, in __call__
    await wrap_app_handling_exceptions(self.app, conn)(scope, receive, send)
  File "/Users/ianmcgraw/miniconda3/envs/openapitest/lib/python3.12/site-packages/starlette/_exception_handler.py", line 64, in wrapped_app
    raise exc
  File "/Users/ianmcgraw/miniconda3/envs/openapitest/lib/python3.12/site-packages/starlette/_exception_handler.py", line 53, in wrapped_app
    await app(scope, receive, sender)
  File "/Users/ianmcgraw/miniconda3/envs/openapitest/lib/python3.12/site-packages/starlette/routing.py", line 758, in __call__
    await self.middleware_stack(scope, receive, send)
  File "/Users/ianmcgraw/miniconda3/envs/openapitest/lib/python3.12/site-packages/starlette/routing.py", line 778, in app
    await route.handle(scope, receive, send)
  File "/Users/ianmcgraw/miniconda3/envs/openapitest/lib/python3.12/site-packages/starlette/routing.py", line 299, in handle
    await self.app(scope, receive, send)
  File "/Users/ianmcgraw/miniconda3/envs/openapitest/lib/python3.12/site-packages/starlette/routing.py", line 79, in app
    await wrap_app_handling_exceptions(app, request)(scope, receive, send)
  File "/Users/ianmcgraw/miniconda3/envs/openapitest/lib/python3.12/site-packages/starlette/_exception_handler.py", line 64, in wrapped_app
    raise exc
  File "/Users/ianmcgraw/miniconda3/envs/openapitest/lib/python3.12/site-packages/starlette/_exception_handler.py", line 53, in wrapped_app
    await app(scope, receive, sender)
  File "/Users/ianmcgraw/miniconda3/envs/openapitest/lib/python3.12/site-packages/starlette/routing.py", line 74, in app
    response = await func(request)
               ^^^^^^^^^^^^^^^^^^^
  File "/Users/ianmcgraw/miniconda3/envs/openapitest/lib/python3.12/site-packages/fastapi/routing.py", line 278, in app
    raw_response = await run_endpoint_function(
                   ^^^^^^^^^^^^^^^^^^^^^^^^^^^^
  File "/Users/ianmcgraw/miniconda3/envs/openapitest/lib/python3.12/site-packages/fastapi/routing.py", line 193, in run_endpoint_function
    return await run_in_threadpool(dependant.call, **values)
           ^^^^^^^^^^^^^^^^^^^^^^^^^^^^^^^^^^^^^^^^^^^^^^^^^
  File "/Users/ianmcgraw/miniconda3/envs/openapitest/lib/python3.12/site-packages/starlette/concurrency.py", line 42, in run_in_threadpool
    return await anyio.to_thread.run_sync(func, *args)
           ^^^^^^^^^^^^^^^^^^^^^^^^^^^^^^^^^^^^^^^^^^^
  File "/Users/ianmcgraw/miniconda3/envs/openapitest/lib/python3.12/site-packages/anyio/to_thread.py", line 56, in run_sync
    return await get_async_backend().run_sync_in_worker_thread(
           ^^^^^^^^^^^^^^^^^^^^^^^^^^^^^^^^^^^^^^^^^^^^^^^^^^^^
  File "/Users/ianmcgraw/miniconda3/envs/openapitest/lib/python3.12/site-packages/anyio/_backends/_asyncio.py", line 2144, in run_sync_in_worker_thread
    return await future
           ^^^^^^^^^^^^
  File "/Users/ianmcgraw/miniconda3/envs/openapitest/lib/python3.12/site-packages/anyio/_backends/_asyncio.py", line 851, in run
    result = context.run(func, *args)
             ^^^^^^^^^^^^^^^^^^^^^^^^
  File "/Users/ianmcgraw/dev/arthur-scope/test-client/app.py", line 17, in error
    raise Exception(body.message)
Exception: test error
TRACE:    127.0.0.1:60338 - HTTP connection lost
```

**Reply by Kludex** [reply]
What's the uvicorn version, and h11? Does it reproduce if you have `httptools` installed?

Also... You have the client logs you mentioned above?

**Reply by mcgrawia** [reply]
if it helps, here are the logs when I add the `time.sleep(0.1)` in between the requests:
```
TRACE:    127.0.0.1:60348 - HTTP connection made
TRACE:    127.0.0.1:60348 - ASGI [3] Started scope={'type': 'http', 'asgi': {'version': '3.0', 'spec_version': '2.4'}, 'http_version': '1.1', 'server': ('127.0.0.1', 8000), 'client': ('127.0.0.1', 60348), 'scheme': 'http', 'method': 'POST', 'root_path': '', 'path': '/error', 'raw_path': b'/error', 'query_string': b'', 'headers': '<...>', 'state': {}}
TRACE:    127.0.0.1:60348 - ASGI [3] Receive {'type': 'http.request', 'body': '<25 bytes>', 'more_body': False}
TRACE:    127.0.0.1:60348 - ASGI [3] Send {'type': 'http.response.start', 'status': 400, 'headers': '<...>'}
INFO:     127.0.0.1:60348 - "POST /error HTTP/1.1" 400 Bad Request
TRACE:    127.0.0.1:60348 - ASGI [3] Send {'type': 'http.response.body', 'body': '<23 bytes>'}
TRACE:    127.0.0.1:60348 - ASGI [3] Raised exception
ERROR:    Exception in ASGI application
Traceback (most recent call last):
  File "/Users/ianmcgraw/miniconda3/envs/openapitest/lib/python3.12/site-packages/uvicorn/protocols/http/h11_impl.py", line 407, in run_asgi
    result = await app(  # type: ignore[func-returns-value]
             ^^^^^^^^^^^^^^^^^^^^^^^^^^^^^^^^^^^^^^^^^^^^^^
  File "/Users/ianmcgraw/miniconda3/envs/openapitest/lib/python3.12/site-packages/uvicorn/middleware/proxy_headers.py", line 69, in __call__
    return await self.app(scope, receive, send)
           ^^^^^^^^^^^^^^^^^^^^^^^^^^^^^^^^^^^^
  File "/Users/ianmcgraw/miniconda3/envs/openapitest/lib/python3.12/site-packages/uvicorn/middleware/message_logger.py", line 84, in __call__
    raise exc from None
  File "/Users/ianmcgraw/miniconda3/envs/openapitest/lib/python3.12/site-packages/uvicorn/middleware/message_logger.py", line 80, in __call__
    await self.app(scope, inner_receive, inner_send)
  File "/Users/ianmcgraw/miniconda3/envs/openapitest/lib/python3.12/site-packages/fastapi/applications.py", line 1054, in __call__
    await super().__call__(scope, receive, send)
  File "/Users/ianmcgraw/miniconda3/envs/openapitest/lib/python3.12/site-packages/starlette/applications.py", line 123, in __call__
    await self.middleware_stack(scope, receive, send)
  File "/Users/ianmcgraw/miniconda3/envs/openapitest/lib/python3.12/site-packages/starlette/middleware/errors.py", line 186, in __call__
    raise exc
  File "/Users/ianmcgraw/miniconda3/envs/openapitest/lib/python3.12/site-packages/starlette/middleware/errors.py", line 164, in __call__
    await self.app(scope, receive, _send)
  File "/Users/ianmcgraw/miniconda3/envs/openapitest/lib/python3.12/site-packages/starlette/middleware/exceptions.py", line 62, in __call__
    await wrap_app_handling_exceptions(self.app, conn)(scope, receive, send)
  File "/Users/ianmcgraw/miniconda3/envs/openapitest/lib/python3.12/site-packages/starlette/_exception_handler.py", line 64, in wrapped_app
    raise exc
  File "/Users/ianmcgraw/miniconda3/envs/openapitest/lib/python3.12/site-packages/starlette/_exception_handler.py", line 53, in wrapped_app
    await app(scope, receive, sender)
  File "/Users/ianmcgraw/miniconda3/envs/openapitest/lib/python3.12/site-packages/starlette/routing.py", line 758, in __call__
    await self.middleware_stack(scope, receive, send)
  File "/Users/ianmcgraw/miniconda3/envs/openapitest/lib/python3.12/site-packages/starlette/routing.py", line 778, in app
    await route.handle(scope, receive, send)
  File "/Users/ianmcgraw/miniconda3/envs/openapitest/lib/python3.12/site-packages/starlette/routing.py", line 299, in handle
    await self.app(scope, receive, send)
  File "/Users/ianmcgraw/miniconda3/envs/openapitest/lib/python3.12/site-packages/starlette/routing.py", line 79, in app
    await wrap_app_handling_exceptions(app, request)(scope, receive, send)
  File "/Users/ianmcgraw/miniconda3/envs/openapitest/lib/python3.12/site-packages/starlette/_exception_handler.py", line 64, in wrapped_app
    raise exc
  File "/Users/ianmcgraw/miniconda3/envs/openapitest/lib/python3.12/site-packages/starlette/_exception_handler.py", line 53, in wrapped_app
    await app(scope, receive, sender)
  File "/Users/ianmcgraw/miniconda3/envs/openapitest/lib/python3.12/site-packages/starlette/routing.py", line 74, in app
    response = await func(request)
               ^^^^^^^^^^^^^^^^^^^
  File "/Users/ianmcgraw/miniconda3/envs/openapitest/lib/python3.12/site-packages/fastapi/routing.py", line 278, in app
    raw_response = await run_endpoint_function(
                   ^^^^^^^^^^^^^^^^^^^^^^^^^^^^
  File "/Users/ianmcgraw/miniconda3/envs/openapitest/lib/python3.12/site-packages/fastapi/routing.py", line 193, in run_endpoint_function
    return await run_in_threadpool(dependant.call, **values)
           ^^^^^^^^^^^^^^^^^^^^^^^^^^^^^^^^^^^^^^^^^^^^^^^^^
  File "/Users/ianmcgraw/miniconda3/envs/openapitest/lib/python3.12/site-packages/starlette/concurrency.py", line 42, in run_in_threadpool
    return await anyio.to_thread.run_sync(func, *args)
           ^^^^^^^^^^^^^^^^^^^^^^^^^^^^^^^^^^^^^^^^^^^
  File "/Users/ianmcgraw/miniconda3/envs/openapitest/lib/python3.12/site-packages/anyio/to_thread.py", line 56, in run_sync
    return await get_async_backend().run_sync_in_worker_thread(
           ^^^^^^^^^^^^^^^^^^^^^^^^^^^^^^^^^^^^^^^^^^^^^^^^^^^^
  File "/Users/ianmcgraw/miniconda3/envs/openapitest/lib/python3.12/site-packages/anyio/_backends/_asyncio.py", line 2144, in run_sync_in_worker_thread
    return await future
           ^^^^^^^^^^^^
  File "/Users/ianmcgraw/miniconda3/envs/openapitest/lib/python3.12/site-packages/anyio/_backends/_asyncio.py", line 851, in run
    result = context.run(func, *args)
             ^^^^^^^^^^^^^^^^^^^^^^^^
  File "/Users/ianmcgraw/dev/arthur-scope/test-client/app.py", line 17, in error
    raise Exception(body.message)
Exception: test error
TRACE:    127.0.0.1:60348 - HTTP connection lost
TRACE:    127.0.0.1:60349 - HTTP connection made
TRACE:    127.0.0.1:60349 - ASGI [4] Started scope={'type': 'http', 'asgi': {'version': '3.0', 'spec_version': '2.4'}, 'http_version': '1.1', 'server': ('127.0.0.1', 8000), 'client': ('127.0.0.1', 60349), 'scheme': 'http', 'method': 'POST', 'root_path': '', 'path': '/ok', 'raw_path': b'/ok', 'query_string': b'', 'headers': '<...>', 'state': {}}
TRACE:    127.0.0.1:60349 - ASGI [4] Receive {'type': 'http.request', 'body': '<25 bytes>', 'more_body': False}
TRACE:    127.0.0.1:60349 - ASGI [4] Send {'type': 'http.response.start', 'status': 200, 'headers': '<...>'}
INFO:     127.0.0.1:60349 - "POST /ok HTTP/1.1" 200 OK
TRACE:    127.0.0.1:60349 - ASGI [4] Send {'type': 'http.response.body', 'body': '<4 bytes>'}
TRACE:    127.0.0.1:60349 - ASGI [4] Completed
TRACE:    127.0.0.1:60349 - HTTP connection lost
```

**Reply by mcgrawia** [reply]
Here's my entire python environment, `h11==0.14.0`, `uvicorn==0.29.0`. Sorry what do you mean by client logs? The logs from the client are in my original post^. Is there something else from the client side you're looking for? Let me try installing `httptools` and see
```
pip freeze
annotated-types==0.6.0
anyio==4.3.0
certifi==2024.2.2
charset-normalizer==3.3.2
click==8.1.7
fastapi==0.110.0
h11==0.14.0
idna==3.6
pydantic==2.6.4
pydantic_core==2.16.3
python-dateutil==2.9.0.post0
pythonclient @ file:///Users/ianmcgraw/dev/arthur-scope/test-client/client
requests==2.31.0
setuptools==68.2.2
six==1.16.0
sniffio==1.3.1
starlette==0.36.3
tenacity==8.2.3
typing_extensions==4.10.0
urllib3==2.0.7
uvicorn==0.29.0
wheel==0.41.2
```

**Reply by mcgrawia** [reply]
Installing `httptools` did not seem to change anything, here's the full client output:
```
python python_requests.py
Traceback (most recent call last):
  File "/Users/ianmcgraw/miniconda3/envs/openapitest/lib/python3.12/site-packages/urllib3/connectionpool.py", line 791, in urlopen
    response = self._make_request(
               ^^^^^^^^^^^^^^^^^^^
  File "/Users/ianmcgraw/miniconda3/envs/openapitest/lib/python3.12/site-packages/urllib3/connectionpool.py", line 537, in _make_request
    response = conn.getresponse()
               ^^^^^^^^^^^^^^^^^^
  File "/Users/ianmcgraw/miniconda3/envs/openapitest/lib/python3.12/site-packages/urllib3/connection.py", line 461, in getresponse
    httplib_response = super().getresponse()
                       ^^^^^^^^^^^^^^^^^^^^^
  File "/Users/ianmcgraw/miniconda3/envs/openapitest/lib/python3.12/http/client.py", line 1423, in getresponse
    response.begin()
  File "/Users/ianmcgraw/miniconda3/envs/openapitest/lib/python3.12/http/client.py", line 331, in begin
    version, status, reason = self._read_status()
                              ^^^^^^^^^^^^^^^^^^^
  File "/Users/ianmcgraw/miniconda3/envs/openapitest/lib/python3.12/http/client.py", line 292, in _read_status
    line = str(self.fp.readline(_MAXLINE + 1), "iso-8859-1")
               ^^^^^^^^^^^^^^^^^^^^^^^^^^^^^^
  File "/Users/ianmcgraw/miniconda3/envs/openapitest/lib/python3.12/socket.py", line 707, in readinto
    return self._sock.recv_into(b)
           ^^^^^^^^^^^^^^^^^^^^^^^
ConnectionResetError: [Errno 54] Connection reset by peer

During handling of the above exception, another exception occurred:

Traceback (most recent call last):
  File "/Users/ianmcgraw/miniconda3/envs/openapitest/lib/python3.12/site-packages/requests/adapters.py", line 486, in send
    resp = conn.urlopen(
           ^^^^^^^^^^^^^
  File "/Users/ianmcgraw/miniconda3/envs/openapitest/lib/python3.12/site-packages/urllib3/connectionpool.py", line 845, in urlopen
    retries = retries.increment(
              ^^^^^^^^^^^^^^^^^^
  File "/Users/ianmcgraw/miniconda3/envs/openapitest/lib/python3.12/site-packages/urllib3/util/retry.py", line 470, in increment
    raise reraise(type(error), error, _stacktrace)
          ^^^^^^^^^^^^^^^^^^^^^^^^^^^^^^^^^^^^^^^^
  File "/Users/ianmcgraw/miniconda3/envs/openapitest/lib/python3.12/site-packages/urllib3/util/util.py", line 38, in reraise
    raise value.with_traceback(tb)
  File "/Users/ianmcgraw/miniconda3/envs/openapitest/lib/python3.12/site-packages/urllib3/connectionpool.py", line 791, in urlopen
    response = self._make_request(
               ^^^^^^^^^^^^^^^^^^^
  File "/Users/ianmcgraw/miniconda3/envs/openapitest/lib/python3.12/site-packages/urllib3/connectionpool.py", line 537, in _make_request
    response = conn.getresponse()
               ^^^^^^^^^^^^^^^^^^
  File "/Users/ianmcgraw/miniconda3/envs/openapitest/lib/python3.12/site-packages/urllib3/connection.py", line 461, in getresponse
    httplib_response = super().getresponse()
                       ^^^^^^^^^^^^^^^^^^^^^
  File "/Users/ianmcgraw/miniconda3/envs/openapitest/lib/python3.12/http/client.py", line 1423, in getresponse
    response.begin()
  File "/Users/ianmcgraw/miniconda3/envs/openapitest/lib/python3.12/http/client.py", line 331, in begin
    version, status, reason = self._read_status()
                              ^^^^^^^^^^^^^^^^^^^
  File "/Users/ianmcgraw/miniconda3/envs/openapitest/lib/python3.12/http/client.py", line 292, in _read_status
    line = str(self.fp.readline(_MAXLINE + 1), "iso-8859-1")
               ^^^^^^^^^^^^^^^^^^^^^^^^^^^^^^
  File "/Users/ianmcgraw/miniconda3/envs/openapitest/lib/python3.12/socket.py", line 707, in readinto
    return self._sock.recv_into(b)
           ^^^^^^^^^^^^^^^^^^^^^^^
urllib3.exceptions.ProtocolError: ('Connection aborted.', ConnectionResetError(54, 'Connection reset by peer'))

During handling of the above exception, another exception occurred:

Traceback (most recent call last):
  File "/Users/ianmcgraw/dev/arthur-scope/test-client/python_requests.py", line 14, in <module>
    main()
  File "/Users/ianmcgraw/dev/arthur-scope/test-client/python_requests.py", line 10, in main
    resp = session.post("http://127.0.0.1:8000/ok", json={"message": "test error"})
           ^^^^^^^^^^^^^^^^^^^^^^^^^^^^^^^^^^^^^^^^^^^^^^^^^^^^^^^^^^^^^^^^^^^^^^^^
  File "/Users/ianmcgraw/miniconda3/envs/openapitest/lib/python3.12/site-packages/requests/sessions.py", line 637, in post
    return self.request("POST", url, data=data, json=json, **kwargs)
           ^^^^^^^^^^^^^^^^^^^^^^^^^^^^^^^^^^^^^^^^^^^^^^^^^^^^^^^^^
  File "/Users/ianmcgraw/miniconda3/envs/openapitest/lib/python3.12/site-packages/requests/sessions.py", line 589, in request
    resp = self.send(prep, **send_kwargs)
           ^^^^^^^^^^^^^^^^^^^^^^^^^^^^^^
  File "/Users/ianmcgraw/miniconda3/envs/openapitest/lib/python3.12/site-packages/requests/sessions.py", line 703, in send
    r = adapter.send(request, **kwargs)
        ^^^^^^^^^^^^^^^^^^^^^^^^^^^^^^^
  File "/Users/ianmcgraw/miniconda3/envs/openapitest/lib/python3.12/site-packages/requests/adapters.py", line 501, in send
    raise ConnectionError(err, request=request)
requests.exceptions.ConnectionError: ('Connection aborted.', ConnectionResetError(54, 'Connection reset by peer'))
```

**Reply by Kludex** [reply]
> Sorry what do you mean by client logs? The logs from the client are in my original post^. Is there something else from the client side you're looking for?

It's fine. I was just confirming.

**Reply by Kludex** [reply]
Does it reproduce with httpx?

**Reply by Kludex** [reply]
I think what is happening is that uvicorn is closing the connection after the first request, and the requests session is not using a new connection to the next request, and the request gets closed... Something like that...

**Reply by mcgrawia** [reply]
It seems to reproduce with httpx as well:
```python
from httpx import Client


def main():
    with Client() as client:
        resp = client.post(
            "http://127.0.0.1:8000/error", json={"message": "test error"}
        )
        assert resp.status_code == 400
        resp = client.post("http://127.0.0.1:8000/ok", json={"message": "test error"})


if __name__ == "__main__":
    main()
```

Logs:
```
python httpx_requests.py
Traceback (most recent call last):
  File "/Users/ianmcgraw/miniconda3/envs/openapitest/lib/python3.12/site-packages/httpx/_transports/default.py", line 69, in map_httpcore_exceptions
    yield
  File "/Users/ianmcgraw/miniconda3/envs/openapitest/lib/python3.12/site-packages/httpx/_transports/default.py", line 233, in handle_request
    resp = self._pool.handle_request(req)
           ^^^^^^^^^^^^^^^^^^^^^^^^^^^^^^
  File "/Users/ianmcgraw/miniconda3/envs/openapitest/lib/python3.12/site-packages/httpcore/_sync/connection_pool.py", line 216, in handle_request
    raise exc from None
  File "/Users/ianmcgraw/miniconda3/envs/openapitest/lib/python3.12/site-packages/httpcore/_sync/connection_pool.py", line 196, in handle_request
    response = connection.handle_request(
               ^^^^^^^^^^^^^^^^^^^^^^^^^^
  File "/Users/ianmcgraw/miniconda3/envs/openapitest/lib/python3.12/site-packages/httpcore/_sync/connection.py", line 101, in handle_request
    return self._connection.handle_request(request)
           ^^^^^^^^^^^^^^^^^^^^^^^^^^^^^^^^^^^^^^^^
  File "/Users/ianmcgraw/miniconda3/envs/openapitest/lib/python3.12/site-packages/httpcore/_sync/http11.py", line 143, in handle_request
    raise exc
  File "/Users/ianmcgraw/miniconda3/envs/openapitest/lib/python3.12/site-packages/httpcore/_sync/http11.py", line 113, in handle_request
    ) = self._receive_response_headers(**kwargs)
        ^^^^^^^^^^^^^^^^^^^^^^^^^^^^^^^^^^^^^^^^
  File "/Users/ianmcgraw/miniconda3/envs/openapitest/lib/python3.12/site-packages/httpcore/_sync/http11.py", line 186, in _receive_response_headers
    event = self._receive_event(timeout=timeout)
            ^^^^^^^^^^^^^^^^^^^^^^^^^^^^^^^^^^^^
  File "/Users/ianmcgraw/miniconda3/envs/openapitest/lib/python3.12/site-packages/httpcore/_sync/http11.py", line 224, in _receive_event
    data = self._network_stream.read(
           ^^^^^^^^^^^^^^^^^^^^^^^^^^
  File "/Users/ianmcgraw/miniconda3/envs/openapitest/lib/python3.12/site-packages/httpcore/_backends/sync.py", line 124, in read
    with map_exceptions(exc_map):
  File "/Users/ianmcgraw/miniconda3/envs/openapitest/lib/python3.12/contextlib.py", line 158, in __exit__
    self.gen.throw(value)
  File "/Users/ianmcgraw/miniconda3/envs/openapitest/lib/python3.12/site-packages/httpcore/_exceptions.py", line 14, in map_exceptions
    raise to_exc(exc) from exc
httpcore.ReadError: [Errno 54] Connection reset by peer

The above exception was the direct cause of the following exception:

Traceback (most recent call last):
  File "/Users/ianmcgraw/dev/arthur-scope/test-client/httpx_requests.py", line 14, in <module>
    main()
  File "/Users/ianmcgraw/dev/arthur-scope/test-client/httpx_requests.py", line 10, in main
    resp = client.post("http://127.0.0.1:8000/ok", json={"message": "test error"})
           ^^^^^^^^^^^^^^^^^^^^^^^^^^^^^^^^^^^^^^^^^^^^^^^^^^^^^^^^^^^^^^^^^^^^^^^
  File "/Users/ianmcgraw/miniconda3/envs/openapitest/lib/python3.12/site-packages/httpx/_client.py", line 1145, in post
    return self.request(
           ^^^^^^^^^^^^^
  File "/Users/ianmcgraw/miniconda3/envs/openapitest/lib/python3.12/site-packages/httpx/_client.py", line 827, in request
    return self.send(request, auth=auth, follow_redirects=follow_redirects)
           ^^^^^^^^^^^^^^^^^^^^^^^^^^^^^^^^^^^^^^^^^^^^^^^^^^^^^^^^^^^^^^^^
  File "/Users/ianmcgraw/miniconda3/envs/openapitest/lib/python3.12/site-packages/httpx/_client.py", line 914, in send
    response = self._send_handling_auth(
               ^^^^^^^^^^^^^^^^^^^^^^^^^
  File "/Users/ianmcgraw/miniconda3/envs/openapitest/lib/python3.12/site-packages/httpx/_client.py", line 942, in _send_handling_auth
    response = self._send_handling_redirects(
               ^^^^^^^^^^^^^^^^^^^^^^^^^^^^^^
  File "/Users/ianmcgraw/miniconda3/envs/openapitest/lib/python3.12/site-packages/httpx/_client.py", line 979, in _send_handling_redirects
    response = self._send_single_request(request)
               ^^^^^^^^^^^^^^^^^^^^^^^^^^^^^^^^^^
  File "/Users/ianmcgraw/miniconda3/envs/openapitest/lib/python3.12/site-packages/httpx/_client.py", line 1015, in _send_single_request
    response = transport.handle_request(request)
               ^^^^^^^^^^^^^^^^^^^^^^^^^^^^^^^^^
  File "/Users/ianmcgraw/miniconda3/envs/openapitest/lib/python3.12/site-packages/httpx/_transports/default.py", line 232, in handle_request
    with map_httpcore_exceptions():
  File "/Users/ianmcgraw/miniconda3/envs/openapitest/lib/python3.12/contextlib.py", line 158, in __exit__
    self.gen.throw(value)
  File "/Users/ianmcgraw/miniconda3/envs/openapitest/lib/python3.12/site-packages/httpx/_transports/default.py", line 86, in map_httpcore_exceptions
    raise mapped_exc(message) from exc
httpx.ReadError: [Errno 54] Connection reset by peer
```

**Reply by Kludex** [reply]
I'm not sure if this is really an issue, because it looks the intended behavior to close the connection after an exception on the app's side... What I'm not sure is if we are able to check if a connection is being closed, or something.

Also, if you retry after a second or something, it works, right?

@tomchristie Do you have any insight if this is an issue?

**Reply by mcgrawia** [reply]
Correct, if I insert even a short wait like `sleep(0.1)` in between the exception request and a successful request, the second request works as expected. Here's an example:
```python
import time

from requests.sessions import Session


def main():
    session = Session()
    resp = session.post("http://127.0.0.1:8000/error", json={"message": "test error"})
    assert resp.status_code == 400
    time.sleep(0.1)
    resp = session.post("http://127.0.0.1:8000/ok", json={"message": "test error"})


if __name__ == "__main__":
    main()
```

I'm not sure about the intended behavior, but I can explain our use case if this helps. Our application code raises well-known exceptions like `ValidationException` or `NotFoundException` from within our business logic. We then have a exception handler registered with the application that converts these well known exceptions into the appropriate responses for the http client, so that each endpoint doesn't need to duplicate the exception handling / response translation code. In this use case, exceptions can come up somewhat normally, if for example, a client is checking if a resource exists, so it doesn't seem desirable to close a client connection in that case? If we were to move this code into the endpoints themselves, the response to the client would be exactly the same, but the connection wouldn't be closed.
```python
        @app.exception_handler(Exception)
        async def catch_all_exception_handler(
            request: Request, exc: Exception
        ) -> JSONResponse:
            if isinstance(exc, NotFoundException):
                return JSONResponse(
                    status_code=HTTP_404_NOT_FOUND,
                    content=NotFoundError(detail=str(exc.detail)).model_dump(),
                )
            elif isinstance(exc, ValidationException):
                return JSONResponse(
                    status_code=HTTP_400_BAD_REQUEST,
                    content=BadRequestError(detail=str(exc.detail)).model_dump(),
                )
            else:
                return JSONResponse(
                    status_code=HTTP_500_INTERNAL_SERVER_ERROR,
                    content=InternalServerError(detail="").model_dump(),
                )
```

**Reply by mcgrawia** [reply]
Hi @Kludex and @tomchristie, just wanted to follow up on this. What are next steps to determine if this is something that can be fixed? I'd be happy to attempt a PR if someone could point me in the right direction. Thanks

**Reply by mcgrawia** [reply, marked as answer]
After taking another look today, I actually think I figured this out. It turns out, Starlette treats exception handlers that handle `Exception` differently than handlers that handle more specific exceptions:

https://github.com/encode/starlette/blob/89fae174a1ea10f59ae248fe030d9b7e83d0b8a0/starlette/applications.py#L92-L92

For exception handlers that handle `Exception`, it uses a `ServerErrorMiddleware` class, which at the end of handling the exception, re-raises it to the Uvicorn layer:

https://github.com/encode/starlette/blob/89fae174a1ea10f59ae248fe030d9b7e83d0b8a0/starlette/middleware/errors.py#L186-L186

Then, Uvicorn closes the client connection:

https://github.com/encode/uvicorn/blob/a2219eb2ed2bbda4143a0fb18c4b0578881b1ae8/uvicorn/protocols/http/h11_impl.py#L416-L416

Switching our exception handler in the app to handle a more specific exception than `Exception` seems to have fixed the issue

**Reply by lovelydinosaur** [reply]
Neat work on isolating this more carefully...

General rule here: We're not in a position to debug "x" other project. Ideally `uvicorn` issues ought to be isolated to "this plain ASGI app presents this behavior", before we consider something issue-worthy. (Tho yeah talking things through in a discussion phase in order to get to that might still be useful.)

**Reply by mcgrawia** [reply]
Thanks @tomchristie. Apologies, when I started I was not familiar with the Uvicorn/Starlette/FastAPI stack internals, so when I saw the TCP reset packets being sent to the client, I figured Uvicorn was the cause. Thanks for the help.
